{
  "$schema": "http://json-schema.org/draft-07/schema",
  "$id": "https://launchgate.dev/schemas/v1alpha1/traffic-model.schema.json",
  "title": "TrafficModel v1alpha1",
  "type": "object",
  "additionalProperties": false,
  "required": ["apiVersion", "kind", "metadata", "spec"],
  "properties": {
    "apiVersion": { "const": "launchgate.dev/v1alpha1" },
    "kind": { "const": "TrafficModel" },
    "metadata": {
      "type": "object",
      "additionalProperties": false,
      "required": ["name"],
      "properties": {
        "name": { "type": "string", "minLength": 1 },
        "project": { "type": "string", "minLength": 1 },
        "tags": {
          "type": "array",
          "items": { "type": "string", "minLength": 1 },
          "uniqueItems": true
        }
      }
    },
    "spec": {
      "type": "object",
      "additionalProperties": false,
      "required": ["scenarios"],
      "properties": {
        "defaultTags": {
          "type": "object",
          "propertyNames": { "pattern": "^[a-zA-Z0-9_.-]+$" },
          "additionalProperties": { "type": "string" }
        },
        "scenarios": {
          "type": "array",
          "minItems": 1,
          "items": {
            "type": "object",
            "additionalProperties": false,
            "required": ["name", "executor", "stages"],
            "properties": {
              "name": { "type": "string", "minLength": 1 },
              "executor": { "type": "string", "minLength": 1 },
              "tags": {
                "type": "object",
                "propertyNames": { "pattern": "^[a-zA-Z0-9_.-]+$" },
                "additionalProperties": { "type": "string" }
              },
              "stages": {
                "type": "array",
                "minItems": 1,
                "items": {
                  "type": "object",
                  "additionalProperties": false,
                  "required": ["duration", "target"],
                  "properties": {
                    "duration": { "type": "string", "pattern": "^[0-9]+(ms|s|m|h)$" },
                    "target": { "type": "integer", "minimum": 0 }
                  }
                }
              }
            }
          }
        }
      }
    }
  }
}
